{
  "schema_version": 1,
  "created_at": "2026-07-29T14:40:33Z",
  "source_context_hash": "2bc9c0efc464bb72b8e54ef45ff1bb0386d31b8be7ca1c67b996b7ff465bb137",
  "model": "Qwen2.5-Coder-7B-Instruct-Q4_K_M",
  "route": "LOCAL_INTEGRATOR_ASSISTANT",
  "status": "dry_run",
  "overall_summary": "3 item(s) are included in the deterministic integration batch. 3 item(s) are excluded and should stay out of Finalizer packages. Excluded route counts: deferred_next_batch=2, excluded_from_package=1.",
  "confidence": 0.5,
  "candidate_advice": [],
  "batch_suggestions": [],
  "warnings": [
    "dry_run advice; no local model call was performed"
  ],
  "forbidden_actions_detected": []
}
